,search,title,date,body
26,Global Core,Global Core is part of the game plan,25 October 2010,"BY YANG HULast week, Stephen Wu (""The Global Core lacks substance,"" Oct. 14) and Grace Bickers (""What world is the Global Core Promoting,"" Spectrum, Oct. 17) laid a good beating on the Global Core, but they have it all wrong. To see why, put aside the Global Core for just a minute. If the work of Plato and Augustine ""remain the pillars of philosophical thought irrespective of the petty contemporary classifications"" as Wu claims, why then, I wonder, do we even bother with the ""Nicomachean Ethics,"" the ""Discourse on Method,"" and ""The Wealth of Nations,"" which would be, as per Wu, just sequels to ""The Republic""? Now that I have finished Contemporary Civilization, am I left up a creek with a load of deadweight in my boat from Aristotle, Descartes, Smith, and the rest of the gang that's done nothing new since Plato?Everyone can agree that the Core Curriculum's objective is to provoke thought about the questions that concern all of mankind. The disagreement now, it seems, lies in whether the Global Core aligns with or runs counter to this objective. Stephen argues that the Global Core is contrary to the Columbia ideal, wherein every student would speak a common, intellectual language. Whereas the Core traditionally encourages students to broaden their minds by emphasizing only ""the most fundamental of concepts,"" the Global Core component poses a non sequitur constraint of studying issues relevant to a particular portion of the human race. But this critique leaves little room for us to appreciate much beyond any small handful of representatives of ""the greatest questions of human civilization."" After all, our Contemporary Civilization authorswere primarily engaged in addressing issues particular to their times, not to catering to our interest in big questions. In Wu's case, Plato and Augustine won the draw and were mentioned in his op-ed. But should we discard the rest? A musician develops fluency in reading music by practicing a varied repertoire. An athlete develops overall dexterity by practicing a variety of ad hoc drills. Likewise, a student develops sensitivity to general questions from the urge to unite seemingly disjointed observations. We need this variety. I wonder how Wu could seriously ponder the ""collective character of the human person"" without first outlining the differences among individuals which make this a nontrivial topic. Besides criticizing the narrowness of the Global Core, Bickers takes broader issue with the appropriateness of cultural classification? I'm confused as to how she could agree that ""knowledge of 'non-Western' cultures is certainly an imperative part of our educational experience"" and simultaneously disapprove of using the same discriminative power that invokes ""non-Western cultures"" in order to avoid ""simplifying the world."" If the term we're using is ""simplify,"" then what we're actually discussing is the merit of an assumption. Which is the more naive assumption, exactly? That there are patterns worth summarizing in the features of various cultures around the world? Or that formalizing common traits between cultures is pretentious, if not intractable? By the way, one of these two is patently un-Core. It's not fair to indict the Global Core for distracting us from the goal of our Core education, especially with a tirade on classification and departmentalization. By erasing the lines of classification, we diminish the achievement of generalization. Let's not forget that in Contemporary Civilization, we earned our awareness of universal questions after we distilled the invariance from a hodgepodge of thoughts in the Western canon. The universality of Plato's and Augustine's thinking is retrospectively obvious, in the same way that a forest's being full of trees is obvious once you've see the forest. Our sense of the important questions of mankind would definitely benefit from the conditioning the Global Core offers, which challenges us to continue making connections, as we do in all Core classes, among any group of cultures in the world. The author is a Columbia College junior majoring in computer science and statistics.It's not fair to indict the Global Core for distracting us from the goal of our Core education."
27,Global Core,"True globalization, true diversity",29 October 2010,"BY WILLIAM THEODORE DE BARYEach Friday, a professor will share scholastic wisdom readers won't find in lectures. Suggestions regarding which professors to feature are welcome.There has been much ado about globalization recently at Columbia, much of it focused on the Global Centers—with new ones likely to open in Paris and Mumbai this spring. Fortunately it has been accompanied by attention also to strengthening the home base to provide for the educational resources needed to support these outreach activitiessome of it in major developments like the Manhattanville campus to provide for growing academic needs; others in seemingly modest ways like providing a center for graduate students where they can meet together to discuss their common needs, as recommended by the Student Affairs Committee of the University Senate. This latter need not be a big project, but it is symbolically important that graduate students should have even a small facility where, to balance the inherent specialization of graduate schools, their common interests and shared concerns can be given a voice on the main campus, so that diversity is grounded in and sustained by shared human values.This is not the first time Columbia has faced the challenge of globalization. When we were thrust unexpectedly and for the first time into World War I, Columbia College responded with a new program called War and Peace Issues that eventually became incorporated into the Contemporary Civilization course, required of all undergraduates as the first component of the new Core Curriculum. This was soon followed in the '3os by Literature, Art, and Music Humanities. External engagement evoked an internal response to meet the challenge. The next phase was World War 11, which led to the development of courses dealing with the Asian Classics and Civilization comparable to those in Literature Humanities and CC, which became part of the core requirements with limited options in the 'sos and '6os. The more recent to-do about globalization so far has been a response primarily to opportunities offered for study centers abroad that focus on mini-campuses in major cities already heavily engaged in the world market economy. It seems a natural response to economic globalization, but the extent to which the new centers have robust links to the University's academic base is unclear. Dual-degree programs have been vetted by the University Senate's Executive Committee and approved by the Senate as a whole. They were treated as routine graduate programs that did not need to be discussed as part of a balanced university education. Study abroad, however, does not satisfy the need for a globalcore, and is no substitute for it. It is fine for summer adventuring but cannot fulfill the purposes of a core curriculum. Meanwhile, the global component of the Core Curriculum has not enjoyed a similar strengthening or enhancement. On the contrary, the present Global Core requirement has undergone such diversification as to erode any concept of core at all. Instead of focusing on shared human concerns across cultures, the distribution has featured diversity in the form of departmentalization or the substitution of different disciplinary approaches to learning. This diversification can of course accommodate itself easily to the variety of opportunities presented abroad, but it is not balanced by attention to the shared human values that should guide the process of globalization. This atrophy of the Core concept is accompanied today by an exclusive emphasis on diversity, as if the latter could stand on its own without consensual agreement on the shared human values that should underlie and nourish respect for diversity. Recently, major appointments to the central administration have been hailed as advancing diversity as a self-sufficient value, and questions as to the educational philosophy that should inform and support diversity go unanswered. As a result, Columbia has tended to lose the distinct educational character that formerly was identified with the College's Core Curriculum and which has so far been the strongest factor in student, faculty andespecially alumni support of the College. Now as we embark on new ""global"" enterprises, the University's increasing costs are being sustained by expanding college enrollment In the past when this had been attempted, the move to increase college tuition income was ostensibly accompanied by supposed enhancements to the College program, but anyone familiar with that program knows that these claimed ""enhancements"" have proven illusory. Any new moves to increase college enrollment should reckon with the danger they could represent to the dilution of the Core and its distinctive small-class, discussionmethod of instruction (in contrast to the large lecture classes exhibiting ""famous"" faculty ""performers"" common to other universities). The weakness of the Global Core and the decay of our commitment to the fundamental concepts of the Core are at the heart of the true question of how to deal with ""globalization."" It is what should be in the forefront of discussion by all segments of the Universitystudent, faculty, alumni—as well as bodies like the University Senate and the central administration. The author is the John Mitchell Mason Professor of the University. He served as provost from 1971-1978. He is a member of the Columbia College class of 1941, received his doctorate from Columbia in 1953, and was awarded an honorary doctorate of letters in 1994.After Office Hours"
28,Global Core,Partners in education?,8 November 2010,"Last week found me in my adviser's office. The topic at hand /as my frantic search for a spring internship. Rather than discuss the available internship options, though, the dean questioned the motivations of the search. Why, she inquired, do I want an internship? What benefit is there to yet another dreary semester-long occupation? Perhaps, she continued, I would use my semester better if I pursued academic interests. After all, I have a lifetime of office work to look forward to, and my time at college is a once-in-a-lifetime opportunity to develop my mind in ways that become unavailable after graduation. Why not take a painting class or that public speaking class at Barnard? Why not do something that would otherwise he impossible had I not taken four years to cultivate my mind? Looking beyond my seemingly primal need for that extra line on my resume, I saw that she had a point—a compelling one. After all, would one additional internship really benefit me substantially in the long run? I began to think that developing an unused side of my mind might serve me better for a longer period of time. Instead of developing myself only as a careerist, why not grow in ways that will benefit every facet of my life? What I found more compelling, though, was the interaction that had just taken place. I had walked into the office with a very solid conception of what I should do during my college career and left having abandoned that conviction in favor of one that would serve me better. Disappointingly, it had taken an external force to correct my shortsighted pursuit. I can't help but extend this scenario to our campus and find that we suffer from this mindset on an institutional level. As the 1968 riots and 2008 hunger strike suggest, we students frequently think that we know what is best for our college education. When the administration doesn't comply with our visions for a Columbia education, we revolt and coerce our way into our ideal. We often get our way, as indicated by the emergence of the global core and the business concentration. I can't help but wonder, though, if we students aren't susceptible to the shortsighted perspective I displayed in the adviser's office. After all, we can really only see what seems to be best for us now—a viewpoint dominated by the ever-nearing prospect of graduation and the ever-narrowing job market. It is extremely difficult for us as students to take a lifelong perspective and ignore the perceived needs of today in favor of the development of tomorrow.Given this, it may be in our best interest to defer to the people who have a better perspective. As empowering as it feels to make dramatic stands for what we think are the most beneficial aspects of education, it may be time to listen to what our professors and other established individuals have to say. It may be time to embrace the role of pupil and leave the teaching to the teachers. This concept shouldn't be foreign to Columbia students. After all, the Core Curriculum is a program that compels students to become educated in areas that would not otherwise be attractive to them. If students had a better conception of what it means to cultivate one's mind, then the administration wouldn't have to force us to read ""The Iliad,"" listen to Mozart, or compute the distance to the nearest star. In actuality, students have very strong incentives to do what serves them best in the short term. It takes external guidance to get us to work on our foundational development. This stance puts me in a difficult position since it seems to oppose the belief in freedom for the individual. If, for example, I suggested a University-wide ban on internships for the first three academic years, how could I defend it? What it comes down to is the nature of the University. Think of it as buying a service. By paying tuition, we are essentially hiring Columbia to develop us into individuals ready to contribute meaningfully to the world by the time we graduate. If we come into our college experience thinking that we know what is best for our education, we deny the experience and expertise of the professionals here. While I don't think that every instance of student activism for curricular changes is misguided or ineffectual, I do think that we as a student body should start giving the faculty the benefit of the doubt. It may irk us to acknowledge that they may know better than we do what is best for us, but we ignore them at our peril. Derek Turner is a Columbia College junior majoring in anthropology and political science. He is director of intergroup affairs for the Columbia University College Republicans. Opening Remarks runs alternate Mondays.It takes external guidance to get us to work on our foundational development.DEREK TURNER Opening Remarks"
29,Global Core,"At year's first CCSC meeting, talk of dining changes, drug policies, new website",24 January 2011,"BY LEAH GREENBAUM Spectator Senior Staff WriterThe Columbia College Student Council began the spring semester vamped website and a new list of priorities. The council is likely to discuss reforming party and alcohol policies, the role of the Global Core requirement, and making the switch from Cub Mail to Gmail, said CCSC President Learned Foote, CC 'll. In addition to voting on new resolutions, Foote said CCSC will continue to work with the administration on changes to the new meal plan. In October, the council passed a series of recommendations asking Columbia Dining to reopen John Jay Dining Hall on weekends and revive the a la carte menu at JJ's Place. Those suggestions followed changes, implemented last fall, that have been profitable for the University but, according to CCSC surveys, disappointing to students. Foote said Dining will not negotiate reopening John Jay on weekends until March, when dining plans will be renewed and labor contracts with University employees run out. ""Changing what people had already bought didn't seemlike an option to Dining,"" Foote said, when asked why the changes couldn't be negotiated sooner. X * *»Footesalso annouaced that < ""Qffic® of' vj Affairs is reaching' out to the class councils to discuss the long-term effects of the December arrests of five Columbia students accused of selling drugs on campus. ""A lot of administrators are looking to work specifically with the councils.... They want to talk about how are students treated in their dorms by RAs, how they are treated by the NYPD ... to what degree does the judicial affairs process need to be transparent,"" he said. Despite the headlinegrabbing drug bust, Foote said that the University is still very receptive to the ""Good Samaritan"" policy, a proposal the council passed last semester that would grant amnesty to people and organizations who call ambulances for friends in the presence of underage drinking or illegal drugs. The council is working with the administration to finalize the language of that proposal, he said. Andrew Nguyen, CC 'l2 and vice president of policy for CCSC, said he hopes the council will take another shot atreforming party policies, specifically by making it easier for student groups to host events with alcohol. w Currently, the only student^alcohol are Lerner Pub' ana First Friday, both of which require two IDs to drink. Last year's vice president of policy, Sarah Weiss, CC 'lO, said that CCSC had given up on trying to renegotiate party policies, even though CCSC was once a strong critic of the ""War on Fun""—an alleged push by the University, beginning in 2007, to limit alcohol consumption, break up parties, and regulate events. ""There are restrictionslegal reasons—why students can't drink. So we feel there are greater battles to be fought,"" she told Spectator in December 2009, adding that those pushing for reform create unnecessary tension with the University. Karishma Habbu, CC 'l3 and vice president of communications, also unveiled a redesigned CCSC website with a Twitter feed. ""I've never tweeted before,"" said Foote—an admission that was met with disbelief from fellow council members. leah.greenbaum @columbiaspectator.com"
30,Global Core,Committee considers revisions to Global Core,10 February 2011,"BY MELANIE BRODER Spectator Staff WriterLess than three years since the requirement's debut, changes are coming to the Global Core. The University's Committee on the Global Core is looking to change the size and number of classes focused on ""nonWestern"" cultures that meet the Global Core requirement. ""The ideal is to have those courses resemble CC [Contemporary Civilization] and Lit Hum courses,"" said Kathryn Yatrakis, dean of academic affairs at Columbia College.To accomplish that, the list of courses that meet the requirement will be getting shorter, according to Patricia Grieve, the chair of the faculty Committee on the Global Core and the Nancy and Jeffrey Marcus Professor in the Humanities. The committee also plans to increase the number of small seminars and form connections between Global Core courses in an effort to bringthe requirement into line with other parts of the Core. Such changes would address criticisms like those of Kevin Zhai, CC 'l2, who said the Global Core doesn't build community like Lit Hum and Contemporary Civilization do. ""I just think it's sort of bizarre where people have to choose [among different courses], and there is no unifying theme of 'Global Core-ness,""' he added.The two-course Global Core requirement was instituted in fall 2008, replacing the previous Major Cultures requirement, which the class of 2011 still has the option to fulfill. Grieve said that in 2008, the University made the list of courses ""larger than we think is ideal"" to make sure that all students were able to fulfill the requirement. According to the 2010-11 Columbia College Bulletin, over 120 courses currently fulfill the requirement, though most of those classes are not offered in a given semester. ""This year, the Committee is looking to reduce the number of courses on the list in consultation with the faculty who teach them, as new courses are developed, and as the criteria for Global Core become fully articulated,"" Grieve said in a statement. But overhauling a major curriculum requirement comes with challenges. Though the committee wants to encourage small seminars, Grieve noted that some departments offering important Global Core courses don't have enough instructors to replace all of their large lectures with seminars. One option is adding discussion sections to large lectures, though the committee is still determining the best way to make the changes. ""The Committee is currently examining ways to help faculty include a substantive discussion component in courses ... in order to allow for the kind of student interaction that is the hallmark of other Core courses,"" Grieve said. The Global Core is feeling pressure from more than just the faculty committee. Columbia College Student Council sent out a poll in early December asking students their opinions on the Global Core. Of the 171 students who responded to the survey, 65 percent said they did not feel the Global Core has a clear mission or purpose. Just over 70 percent said they felt that the best format for Global Core classes is ""small seminars, like Lit Hum and CC [Contemporary Civilization]."" ""There's such strong development in the Core Curriculum that the Global Core gets shafted, in a way, because it's so new,"" Amanda Tan, CC 'll and CCSC's academic affairs representative, said. Tan and Alex Jasiulek, the president for the Class of 2013 have been communicating about reviewing the Global Core, and hope to encourage more student participation in the revision process by holding a schoolwide open forum. The CCSC survey also showed a large divide among students about what the Global Core should accomplish. Almost 56 percent of respondents said they thought its main purpose is to ""introduce students to 'non-Western' cultures,"" and just over 45 percent said they think its purpose should be to ""give students a theoretical framework for examining both 'non-Western' cultures and the 'Western' culture that informs our own thinking."" Tony Baker, CC 'l3, agreed that a sense of ambiguity in the Global Core made for a superficial treatment of non-Western culture. ""I just think that two semesters is kind of token,"" Baker said. ""If you want to major in those areas, then you can really get a deeper appreciation of those subjects, but everyone just kind of does like a one year huge gloss-over survey."" Barry Weinberg, CC 'l2 and student representative to the University's Committee on the Core, said he hopes discussing the Global Core is part of a larger discussion on what the Core Curriculum means to Columbia students. ""There is an interest in the students for kind of a large event or a campus-wide dialogue on what the Core really means to Columbia and how it applies today,"" Weinberg said. ""And part of that would be how the Global Core fits in."" Sammy Roth contributed reporting. melanie.broder@columbiaspectator.com""There's such strong development in the Core Curriculum that the Global Core gets shafted, in a way, because it's so new."" —Amanda Tan, CC 'll"
31,Global Core,STAFF EDITORIAL Correcting the core,16 February 2011,"Correcting the coreAs a relatively new addition to the Columbia Core Curriculum, the Global Core is undergoing continual reevaluation. The proposed changes highlight serious flaws in the structure of Global Core classes. Global Core courses have been criticized for being too large, too broad, and too dissimilar from other core classes like Contemporary Civilization or Literature Humanities. The Committee on the Global Core is considering adding more discussion sections to large lectures and increasing the number of seminars, which may reduce the number of Global Core classes offered. While we applaud the initiative to decrease class sizes, we question whether the Global Core courses should be modeled after the arguably more successful CC and Lit Hum. A Western canonical trajectory may not suit the rest of the world. Either way, it's evident that the Global Core suffers from internal issues as well as structural flaws. The survey courses that most students take to fulfill the Global Core requirement often treat varied and complex material in a brusque and superficial manner.Survey courses try to narrativize the histories of huge, often dissimilar regions—the Middle East or Africa—in a linear fashion. This approach means that students are familiar with the texts that they study, but not in an intimate fashion. While the proposed changes may help address the Global Core's content-related problems, we still find ourselves unsure over the Global Core's role in Columbia's education. The place of Lit Hum and CC in a Columbia College education, while contested, is relatively clear.Though most students know that the Global Core's premise is to familiarize students with non-Western traditions, it seems that the University lacks a clear, unified vision—or has just failed to communicate the importance of the Global Core and explain why it exists. We sense this confusion when we sign up for a course that turns out to be ""too Western"" to fulfill the Global Core requirement. Especially around course registration, we find ourselves wondering by what standards—if any—the Global Core is based on.It's evident that the Global Core suffers from internal issues as well as structural flaws."
