,search,title,date,body
51,Global Core,Help nominate the new Columbia College dean,11 April 2012,"BY ALEX JASIULEKNow that the time has come to select a new dean of Columbia College, I urge students to participate in the process. We need more than transparency during the committee's search. It is students' responsibility to give critical feedback in the process. Austin Quigley was the dean of Columbia College for 14 years, and whichever dean is chosen could last as long if not longer in that position. We currently have until April 15 (half a week) to produce a list of candidates from which the committee will appoint a dean that could be here long after we have graduated and gone off into the world as alumni. Being complacent is not an option since our previous dean, Michele Moody-Adams, resigned due to upcoming changes that she deemed would ""compromise the college's academic quality and financial health."" As current students invested in the long-term health of our school, we must nominate. As issues arise over the next years like the Core Curriculum endowment, physical expansion, and other changes that we can only speculate about, it is important that we have a dean who is willing to go to bat for students on the most important issues. If students do not participate in the process, then it is very likely that there will be a shortlist of candidates who are not willing to dissent against the central administration. When making my nomination, I expect the candidate to understand the diverse interests of students on campus and be critically engaged with the academic experience of undergraduates. My candidate will push for a Core that interrogates the notion of western civilization and global history in an era that fundamentally challenges those categories. This naturally must be coupled with support of a more dynamic and structured Global Core. My candidate will support greater emphasis on marginalized studies like ethnic, African-American, women and gender, etc. My candidate will not sit idly by when student privacy is violated by the New York Police Department or when issues of the college's long-term health arise. Lastly, my candidate will demand ethical expansion both in Harlem and around the globe as the University continues to grow. These issues matter to me as a student havingwitnessed the ongoing hate between Columbia College students and those at Barnard, General Studies, and School of Engineering and Applied Science, as well as the many bias incidents in the past years and community agitation over labor and land disputes. Students need to have a stronger background in social sciences and identity studies if we are to better engage with each other civilly and improve our world at large. We must also be aware of our impact on our extended communities and act in a way that benefits all. While these issues matter to me and many other students from identity-based, social justice, and political groups on campus, there are other positions important to students that I do not know how to voice. These voices must be heard for the selection committee to best represent all student interests. Additionally, the student council of Columbia College will be submitting a resolution that gives minimum expectations to the incoming dean like meeting regularly with students, attending campus events, maintaining transparency, and fighting for students' rights. This year we noticed a sloppy transition process that, despite Dean James Valentini's good faith, will be utterly unacceptable in the incoming year. Students must hold the incoming dean accountable for meeting basic requirements while taking the initiative to improve undergraduate life. The best way to ensure this is by nominating the right candidates. So again I urge you, it takes 15 minutes to write a letter explaining who you would like to be dean and what qualities they hold that makes them fit to lead our school for the years to come. In these 15 minutes you might be providing the support a faculty member needs to be chosen out of the pool of applicants the committee will be reviewing. Whether you will be graduating this year or not, or even if you have already graduated, take the time to think about what this school needs and who can help make the positive change that you are looking for. Then send an email to nominations@columbia.edu. The author is a Columbia College junior majoring in political science and comparative ethnic studies. He is a CCSC representative for the class 0f2013."
52,Global Core,OPINION,13 April 2012,PAGE 4Meaning behind the Matzo Jessica Hills examines the Passover Seder's contemporary significance. Intercultural Core Professor Rachel Chung on the role of the Global Core in a global world.
53,Global Core,Toward a true global core,13 April 2012,"BY RACHEL E. CHUNGIn 2008, Columbia hosted an international conference on Global Core curriculum, which drew much attention to our historical role in shaping die direction of global core worldwide. As we continue in the struggle to find the right approach and balance within our own Global Core—which I will abbreviate as GC—it occurred to me that GC carries enormous ramifications for the standing of the University as a whole within the global community, touching everything from the success of the new global centers to Columbia's ability to represent future leadership of the ""American university."" It also occurred to me that the solution to our struggle rests not in structural or curricular changes, but in rethinking the pedagogy. Our students will soon be living in a time when it will be increasingly meaningless to speak of a Western Core or indeed even of ""the West' without having global consciousness front and center. In some circles, the word ""global"" has become a kind of ""non-speak"" lately, but in my view that's only because 1) we've become used to a very one-sided view of history, 2) we tend to equate globalization with inevitable syncretism and loss of local identity, and 3) most of all, because we haven't clearly distinguished between multicultural consciousness and global consciousness. ""Global"" is a very different animal than ""multicultural."" Columbia was among the first universities to recognize theEach Friday, a professor will share scholastic wisdom readers won't find in lectures. Suggestions regarding which professors to feature are welcome. core-ness of learning about other civilizations, but for all that, our non-Western Core has been more or less ornamental addons to what is frequently regarded as the ""core of the Core."" For decades, this was fine. If it didn't anticipate the future, at least it reflected a working reality of the world, and it allowed for an educational model prioritizing one's own tradition—whatever one's soil—before going on to learn those of others. If we use the metaphor of ""the Great Conversation,"" Contemporary Civilization imparted to students an awareness of the nature of the ongoing Conversation and an appreciation for the fact that as thinking citizens, they had the right and the responsibility to participate in it. Multicultural Core simply made students aware of the fact that similar Conversations had been going on in other civilizations as well. The struggle within current GC today is that it's still operating on the level of this multicultural Core, and in some cases, watering even that down to what I call ""myculturalism."" ""Global"" is not merely adding more diverse voices or Conversational topics to the fray-though it's open to that, if desired. Rather, global involves a reconceptualizing of civilizational identity as something gotten in isolation through insistent going over-and-over of landmark moments in one's intellectual/cultural development. Rather, global involves an ongoing process of self-transformation made vital by meaningful interaction with other beings, ideas, and things. I call this interaction on the deepest level ""interculturation."" The West did not become ""the West"" on its own. It was shaped from the coming together of Judeo-Christian and GreekRoman worldviews, from the rich infusion of Arab science and knowledge in the Middle Ages, and from Confucianism and Buddhism that inspired the European Enlightenment,etc. Moreover, these interactions didn't have fixed boundaries—i.e., their influence is so deeply saturated that they have become part of the very way we see and think even as individuals, in that sense becoming generative in their own right. And yet to recognize this does not make the West any less the West, just as the saturation of Buddhism in East Asia is understood today as a revitalization of the culture and not syncretism. In locating civilizational identity in a culture's creative receptivity, its ability to absorb new ideas and adapt them for its own contexts, we empower students to consider, with greater range and depth, the creative, regenerative potential and responsibility of interculturation taking place today—going beyond center-periphery categories to develop simultaneously global and local identities. Interculturation, then, is a pedagogy not to dismantle Columbia's Core, but to shift our collective vantage point to see the Great Conversation that has been happening across civilizations, energizing the Conversations that occur within civilizations, and vice versa. A Core founded on interculturation would focus not on learning about the brilliance of the West and diversity of the rest, but on how and what to learn from the civilizations around us, including the West, without losing sight of what has been central and best to one's self. The timelessness of ""core"" is that we have been doing this throughout history. To be timely means turning to learn from their examples as we face the challenges of globalization in our own contexts. It is only in making this shift to global thinking that I believe Columbia can once again continue to lead the future of the American university and of global corenot just Global Core—in higher education internationally. The author is associate director of the University Committee on Asia and the Middle East and chair of the University Seminar on Global & Interdisciplinary Core Curricula.After Office Hours"
54,Global Core,Panel considers future of the American college,20 April 2012,"BY JEREMY BUDD Spectator Senior Staff WriterWhat is the future of the American college? It's uncertain, according to a recent book by Professor Andrew Delbanco, as well as a panel discussion featuring Delbanco and several other students and prominent professors Thursday night. The panel, moderated by Columbia College Interim Dean James Valentini, focused on the place of a liberal arts education amid preprofessional pressures. Delbanco's book, ""College: What it Was, Is, and Should Be""—which was published last month—served as a springboard for the discussion. Delbanco, the director of the Center for American Studies, said that the ""idea of college as a place for reflection, a place where you can take a breath—that's not happening very much anymore."" ""This is a mild version of the problem where college is conceptualized as a vocational institution,"" he said. ""They're not endangered institutions, but the question is what kind of place they will become."" Director of the Center for the Core Curriculum Roosevelt Montas and political science professor Ira Katznelson, CC '66—a onetime interim executive vice president for Arts and Sciences—also served on the panel with Ganiatu Afolabi, CC 'l2, and Samuel Roth, CC 'l2 and former Spectator editor in chief. 'When we ask about the future of the college, we're taking about a particular idea of the college that is developed in the American context,"" Montas, CC '95, M.A. '96, and Ph.D. 'O4, said. ""And that is to put at the center of the college the idea of a liberal education. That's pretty uniquein the United States."" • Delbanco discussed some of the issues that he believes students and faculty should be concerned about, including increases in class sizes, the difficulty of staffing courses, and the challenge of navigating complicated university bureaucracies. He talked about similar issues, specifically as they pertain to Columbia College, in an on-cam-pus speech in October. ""None of these problems is new, but that doesn't mean we shouldn't complain about them,"" he said. ""That's our job as critics of the present."" The panelists also spent time talking about Columbia specifically. Afolabi said that the administration's lack of transparency concerns her. ""It's really interesting that, in general, we educate students so we can take part in this democracy,"" she said. ""How am I supposed to be a responsible student when I don't even know how the democracy of my own school works?"" One problem at Columbia, Delbanco said, is that several important committees keep their work confidential, limiting public discussions and debate. He cited the Committee onInstruction, which is responsible for approving new courses and reviewing degree requirements, as one example. Still, Delbanco said that some professors remain dedicated to the Core Curriculum. Political science professor emeritus Douglas Chalmers—a member of the Society of Senior Scholarstold the panel that faculty should spend more time refining the Global Core requirement, as students are ""living in a very different world"" than the world that the Core was created in. ""The world is changing. The United States is fading away as a major power,"" he said. ""The West is being confronted with all kinds of new sorts of things—the word is 'globalization.'"" ""The Core Curriculum is kind of stuck on teaching the Western Core and being very prominent,"" he added. ""I think we need to think seriously about how that should change."" Delbanco responded by saying it is ironic that many East Asian universities are considering implementing the fouryear American version of college, rather than the three-year British version. He emphasizedthe importance of discussing the style of the American college. ""My primary motivation is that we need more conversations like this,"" Delbanco said. ""The community that cares about the college should be talking about these issues and not grumbling privately."" Valentini, the moderator, stayed silent for much of the panel. He said that ""the way to have good ideas is to have a lotof ideas, and the way to have a lot of ideas is to have a lot of people thinking,"" but that implementing ideas is always a challenge. ""One does not have to be dean very long to realize that in this community, the porridge is not just too hot or too cold—the porridge needs to be an individual, specific temperature for each of us,"" he said. ""And each person would like the dean to establish that temperature for everyone."" jeremy.budd @co\umbiaspectator.comTHE FUTURE I A panel of prominent professors and students discussed the state of the American college on Thursday evening.CORE QUESTIONS I Columbia College Interim Dean James Valentini moderated a panel on the future of the American college."
55,Global Core,ACADEMICS AND THE CORE,7 May 2012,"If the Core Curriculum is to achieve its goal of helping students ""understand the civilization of our own day and participate effectively in it,"" it must take science seriously. The science requirement demands the same focus that is the strength of the rest of the Core Curriculum, and Columbia should begin by requiring an introductory course in probability and statistics for all students. ""Numerically human,"" Jacob Andreas, SEAS 'l2The Global Core should seek to provide a foundation in non-Western political thought parallel to Contemporary Civilization, laying a groundwork for an exploration of non-Western cultures and providing an alternative to Western thought, along with cultures that draw from the intersection of the West and the East. A class modeled after Asian Humanities is readily available and would provide that groundwork. ""Extending our Core,"" the Editorial BoardThe essentia] point is that faculty should measure up to genuine public standards, not just exhibit popular appeal, and in academia the public standard should be educational—neither just academic in the research sense nor grandstanding before a popular audience. ""An active faculty,"" William Theodore de Bary, John Mitchell Mason Professor of the University, CC '4lEven the most erudite and long-serving professor will not be an expert in all domains of the Core syllabus. Instead, what often makes these classes successful-and I have heard this from both students and faculty—is the more collaborative approach the colossal scope of the readings invites, the shared discovery that results. ""A crisis of values,"" Roderick Cooke, Ph.D. candidate in French and romance philology"
56,Global Core,3 Globalization,27 August 2012,"BY MELISSA VON MAYRHAUSER Spectator Senior Staff WriterColumbia is kicking off several globalization programs this semester, the latest steps in an effort to make a Columbia education a more global experience. In September, the University will launch its newest global center in Rio de Janeiro, Brazil, adding to a list of centers that already includes Amman, Beijing, Istanbul, Mumbai, Nairobi, Paris, and Santiago. University President Lee Bollinger has said that eventually, he wants all students to spend time at the global centers, which serve as research hubs rather than branch campuses. The centers' directors will assemble in New York next month for a conference, as part of newly appointed Vice President for Global Centers Safwan Masri's agenda of increasing communication between the centers and theMorningside Heights community. The directors also plan to speak at the World Leaders Forum, an annual series of events during which heads of state and other international leaders convene at Columbia. Meanwhile, a group of six students participating in a new fifth-year study abroad program will set off on their globe-hopping independent research projects in October. And in March, Barnard will hold a women's leadership symposium in Sao Paulo, Brazil, as part of its ongoing efforts to increase its international reach. Additionally, General Studies students will be required to take Global Core courses for the first time this fall, as students at Columbia College and the School of Engineering and Applied Science are already required to do. Committees have also formed to discuss the idea of offering Core Curriculum classes at the global centers. melissa.vonmayrhauser @columbiaspectator.comWELCOME TO JORDAN I Columbia's global center in Amman opened in 2009 under the patronage of Queen Rania A 1 Abdullah."
57,Global Core,Storytelling and the task of the university,7 September 2012,"BY WEN JINRecently, a Chinese press approached me to discuss a possible translation of ""The Anatomy of Influence,"" Harold Bloom's most recent work of criticism, promising that the translation would draw a big audience. Bloom's earlier book, ""The Western Canon,"" has undoubtedly become the most talkedabout English-language work in literary criticism in China, to which the Chinese readers have left a flood of responses on various book sites expressing opinions ranging from admiration to reverence. These opinions echo, and are reinforced by, New York Times Book Review editor Sam Tanenhaus' recent comment in an NYT podcast that ""in the end you kind of come back to the great books"" as well as his claim in an NYT 2011 interview of Bloom that the latter remains the ""most famous and controversial literary critic of our time."" The canon is by no means dead and gone: It acquires more legitimacy and strength through transnational circulation. So, what do we do about the power of the canon? Where does ethnic or minority literature go? The minority writer emerged in the radical 1960s and early 1970s as an important cultural figure, whose position was both cemented and contested in the ensuing culture wars. Is this figure now starting to lose its purchase on the national imagination and academic curricula? Is there a way in today's universities of honoring both our desire to master the great books and our interest in, not to say responsibility toward, what has been left out of them? One telling sign of the difficulties facing non-canon-ical writers is the reconfiguration of Columbia's Core Curriculum. The new concept of the Global Core does not include courses that investigate the workings of race, ethnicity, or other modes of differentiation within a nation. A course on East Asian literature would certainly count toward the Global Core requirement, but it may not shed light either on the ethnic paradigms in Asia or on the racialization of overseas Asians. The idea of world or global literature may well end up enhancing the power of national canons, however we emphasize their permutations through translation.Each Friday, a professor will share scholastic wisdom readers won't find in lectures. Suggestions regarding which professors to feature are welcome. This is not to say that ethnic cultures have lost their pres- • ence on campus. If we just peruse the Center for the Study ■ of Race and Ethnicity's updated calendar of events, we can easily see how the semester will be densely populated with lectures, talks, conferences, and performances featuring ideas related to immigration, ethnicity, and indigeneity. The tussle between general knowledge (associated with! the great books) and specialized pursuits centering on mi-1 nor and minority archives has for a long time been central; to debates on the functions of the university. Should the; university (both the college and the graduate school) focuson imparting broadly acknowledged ideas or excavatingforgotten and neglected ones? Should the university devote! itself to forging the symbolic bonds bringing people together! or fostering plurality among them? There have never been,and should not be, clear-cut answers to these questionsf The university is simply a space for legitimate intellectualdebates and fights. In the end, the university is not an end in itself. It prepares' us for intellectual and practical projects that can never be accomplished within its confines. Melville is the one who claims that ""true places"" are never in the maps. Indeed, a novel like ""Moby Dick"" can never be conceived on the basis of the knowledge acquired in the academy, and yet it tells us much about the task of the university. Reading ""Moby Dick"" makes us wonder why anyone would elaborate tirelessly on whale classification and the drunken bantering of the shipmates in a book devoted to such exalted ideas as the mythical and symbolic meanings of whaling. The author suggests that he wants to tell a grand story in which every part receives ample attention and careful treatment. A goodstory, like a good place, consists of many strange sites that complement the more popular ""attractions."" The university is that which helps launch us on a lifelong project, in a field of our own choosing, that will ultimately depend on the story we would like to create and present tc£ the world. Whoever will be our audience, nothing should take away our ambition to learn how to tell a grand or even universal story brimming with eccentric, oblique details that used to matter to only a few people. The author is an assistant professor ofEnglish and comparative literature at Columbia.After Office Hours"
